audio_id,segment_id,共情单元起止时间,start_ms,end_ms,来访者表达区间,咨询师回应区间,来访文本,咨询师文本,单元CTE分数,单元CTE分数依据,内容情感反映,接纳确认,促进探索,共情阻碍,共情标签依据,CTE总评分,CTE总评分依据,raw_labels
220228,a47,00：20-00：35,20875,35000,最近总是感觉很累,很累。我看你在那个给我的那个里面好像什么都勾了，我看两性什么恋爱人迹，哈哈哈，所有东西对，你最近是感觉不太好吗？还是,最近总是感觉很累,很累。我看你在那个给我的那个里面好像什么都勾了，我看两性什么恋爱人迹，哈哈哈，所有东西对，你最近是感觉不太好吗？还是,3,能反映来访者表层明显的内容和情绪,,0,0,0,情感反映：很累,2,回应只抓住了部分内容，也可能把情绪理解错，或把情绪说得过模糊,"{""促进探索"": ""0"", ""接纳确认"": ""0"", ""共情阻碍"": ""0"", ""单元CTE分数"": ""3"", ""共情标签依据"": ""情感反映：很累"", ""单元CTE分数依据"": ""能反映来访者表层明显的内容和情绪"", ""CTE总评分"": ""2"", ""来访者表达区间"": ""00：20-00：22"", ""咨询师回应区间"": ""00：23-00：35"", ""CTE总评分依据"": ""回应只抓住了部分内容，也可能把情绪理解错，或把情绪说得过模糊""}"
220228,a48,08：45-08：54,524500,535250,这也就是我痛苦的根源。因为你这种女生太多了。,我这种女生，我这种什么样的女生？你可以但说无妨，我们没有,这也就是我痛苦的根源。因为你这种女生太多了。,我这种女生，我这种什么样的女生？你可以但说无妨，我们没有,1,回应与来访者当下体验无关,,0,1,1,你可以但说无妨、淡化感受、转移话题,2,回应只抓住了部分内容，也可能把情绪理解错，或把情绪说得过模糊,"{""促进探索"": ""1"", ""接纳确认"": ""0"", ""共情阻碍"": ""1"", ""单元CTE分数"": ""1"", ""共情标签依据"": ""你可以但说无妨、淡化感受、转移话题"", ""单元CTE分数依据"": ""回应与来访者当下体验无关"", ""CTE总评分"": ""2"", ""来访者表达区间"": ""08：45-08：48"", ""咨询师回应区间"": ""08：49-08：54"", ""CTE总评分依据"": ""回应只抓住了部分内容，也可能把情绪理解错，或把情绪说得过模糊""}"
220228,a49,15：15-15：30,914625,930250,这样吧，这个需求是两方面的，对吧？一个是当你那个有感觉的时候，这是一种需求，对吧？还有一种就是我觉得我的精力有点少了,你的精力太少了,这样吧，这个需求是两方面的，对吧？一个是当你那个有感觉的时候，这是一种需求，对吧？还有一种就是我觉得我的精力有点少了,你的精力太少了,2,回应只抓住了部分内容，也可能把情绪理解错,,0,0,0,内容反映：精力太少了,2,回应只抓住了部分内容，也可能把情绪理解错，或把情绪说得过模糊,"{""促进探索"": ""0"", ""接纳确认"": ""0"", ""共情阻碍"": ""0"", ""单元CTE分数"": ""2"", ""共情标签依据"": ""内容反映：精力太少了"", ""单元CTE分数依据"": ""回应只抓住了部分内容，也可能把情绪理解错"", ""CTE总评分"": ""2"", ""来访者表达区间"": ""15：15-15：27"", ""咨询师回应区间"": ""15：29-15：30"", ""CTE总评分依据"": ""回应只抓住了部分内容，也可能把情绪理解错，或把情绪说得过模糊""}"
220228,a50,15：32-15：46,930417,946333,一方面是解决那种冲动，一方面就是我感觉那是一种生活，要体验的生活,你觉得生活只有那种体验方式吗,一方面是解决那种冲动，一方面就是我感觉那是一种生活，要体验的生活,你觉得生活只有那种体验方式吗,1,回应与来访者当下体验无关,,0,0,1,转移话题,2,回应只抓住了部分内容，也可能把情绪理解错，或把情绪说得过模糊,"{""促进探索"": ""0"", ""接纳确认"": ""0"", ""共情阻碍"": ""1"", ""单元CTE分数"": ""1"", ""共情标签依据"": ""转移话题"", ""单元CTE分数依据"": ""回应与来访者当下体验无关"", ""CTE总评分"": ""2"", ""来访者表达区间"": ""15：32-15：40"", ""咨询师回应区间"": ""15：43-15：46"", ""CTE总评分依据"": ""回应只抓住了部分内容，也可能把情绪理解错，或把情绪说得过模糊""}"
220228,a123,19：11-19：19,1150832,1160499,我怎么形容呢，反正有个人能抱在怀里还是蛮开心的,被爱，被需要,我怎么形容呢，反正有个人能抱在怀里还是蛮开心的,被爱，被需要,4,4,,0,0,0,情感反映：被爱，被需要,2,回应只抓住了部分内容，也可能把情绪理解错，或把情绪说得过模糊,"{""促进探索"": ""0"", ""接纳确认"": ""0"", ""共情阻碍"": ""0"", ""单元CTE分数"": ""4"", ""共情标签依据"": ""情感反映：被爱，被需要"", ""单元CTE分数依据"": ""4"", ""CTE总评分"": ""2"", ""来访者表达区间"": ""19：11-19：17"", ""咨询师回应区间"": ""19：18-19：19"", ""CTE总评分依据"": ""回应只抓住了部分内容，也可能把情绪理解错，或把情绪说得过模糊""}"
220228,a124,29：45-29：50,1785083,1791250,反正我现在有点累,为啥会累呢？你可别跟我说是因为找不了对象,反正我现在有点累,为啥会累呢？你可别跟我说是因为找不了对象,1,回应与来访者当下体验无关,,0,0,1,评价指责、淡化感受,2,回应只抓住了部分内容，也可能把情绪理解错，或把情绪说得过模糊,"{""促进探索"": ""0"", ""接纳确认"": ""0"", ""共情阻碍"": ""1"", ""单元CTE分数"": ""1"", ""共情标签依据"": ""评价指责、淡化感受"", ""单元CTE分数依据"": ""回应与来访者当下体验无关"", ""CTE总评分"": ""2"", ""来访者表达区间"": ""29：45-29：46"", ""咨询师回应区间"": ""29：47-29：50"", ""CTE总评分依据"": ""回应只抓住了部分内容，也可能把情绪理解错，或把情绪说得过模糊""}"
220228,a125,46：26-46：29,2786500,2789833,好累我操，真的有点累,跟我谈话很累,好累我操，真的有点累,跟我谈话很累,2,回应只抓住了部分内容，也可能把情绪理解错,,0,0,0,情感反映：很累,2,回应只抓住了部分内容，也可能把情绪理解错，或把情绪说得过模糊,"{""促进探索"": ""0"", ""接纳确认"": ""0"", ""共情阻碍"": ""0"", ""单元CTE分数"": ""2"", ""共情标签依据"": ""情感反映：很累"", ""单元CTE分数依据"": ""回应只抓住了部分内容，也可能把情绪理解错"", ""CTE总评分"": ""2"", ""来访者表达区间"": ""46：26-46：28"", ""咨询师回应区间"": ""46：28-46：29"", ""CTE总评分依据"": ""回应只抓住了部分内容，也可能把情绪理解错，或把情绪说得过模糊""}"
220228,a126,46：30-46：59,2789917,2820333,不是跟你谈话很累，跟你谈话挺好的，但是它仍然拯救不了我的身躯,心理咨询它本来就，你要知道它的局限性，它只是一个跟你敞开心扉，然后让你知道你自己是怎么想的一个过程，最后解决问题的肯定是你。也就是所有的心理咨询，包括我，都是一个尽可能帮你去找到适合你方法的一个过程。解决问题这个有点，可能你对我们的,不是跟你谈话很累，跟你谈话挺好的，但是它仍然拯救不了我的身躯,心理咨询它本来就，你要知道它的局限性，它只是一个跟你敞开心扉，然后让你知道你自己是怎么想的一个过程，最后解决问题的肯定是你。也就是所有的心理咨询，包括我，都是一个尽可能帮你去找到适合你方法的一个过程。解决问题这个有点，可能你对我们的,1,回应与来访者当下体验无关,,0,0,1,淡化感受、转移话题,2,回应只抓住了部分内容，也可能把情绪理解错，或把情绪说得过模糊,"{""促进探索"": ""0"", ""接纳确认"": ""0"", ""共情阻碍"": ""1"", ""单元CTE分数"": ""1"", ""共情标签依据"": ""淡化感受、转移话题"", ""单元CTE分数依据"": ""回应与来访者当下体验无关"", ""CTE总评分"": ""2"", ""来访者表达区间"": ""46：30-46：35"", ""咨询师回应区间"": ""46：35-46：59"", ""CTE总评分依据"": ""回应只抓住了部分内容，也可能把情绪理解错，或把情绪说得过模糊""}"
